{
  "story_key": "lebanon_buffer",
  "date": "2026-05-12",
  "title": "Israeli buffer zone in southern Lebanon",
  "slides": [
    {
      "title": "Israeli buffer zone in southern Lebanon",
      "body": "14 buckets · 20 articles · 4 frames",
      "kind": "callout"
    },
    {
      "title": "The paradox",
      "body": "Russian state media (RT) and Hong Kong's South China Morning Post ran near-identical coverage of the Virgin Mary desecration (pairwise similarity 0.835), both treating Israeli military conduct as a s…",
      "kind": "paradox"
    },
    {
      "title": "SECURITY_DEFENSE",
      "body": "7 buckets · \"The IDF's Golani Brigade announced on Tuesday that it recently advanced all the way to the Litani River, around 10 kilometers from the Israeli border, including using robots for portions…",
      "kind": "frame",
      "source": {
        "bucket": "israel",
        "url": "https://www.jpost.com/israel-news/defense-news/article-895888",
        "outlet": "Jerusalem Post"
      }
    },
    {
      "title": "MORALITY",
      "body": "5 buckets · \"Israeli soldiers jailed for desecrating Virgin Mary statue\nTwo Israeli soldiers were sentenced to several weeks in military prison for desecrating a statue of the Virgin Mary in southern…",
      "kind": "frame",
      "source": {
        "bucket": "russia",
        "url": "https://www.rt.com/news/639877-idf-soldiers-christian-statue/?utm_source=rss&utm_medium=rss&utm_campaign=RSS",
        "outlet": "RT"
      }
    },
    {
      "title": "QUALITY_OF_LIFE",
      "body": "4 buckets · \"Lebanese in south refuse to flee again despite escalating Israeli strikes\n\nObaida Hitto reports from southern Lebanon, where residents say they will not leave again despite intensifying…",
      "kind": "frame",
      "source": {
        "bucket": "qatar",
        "url": "https://www.aljazeera.com/video/newsfeed/2026/5/12/lebanese-in-south-refuse-to-flee-again-despite-escalating-israeli-strikes?traffic_source=rss",
        "outlet": "Al Jazeera English"
      }
    },
    {
      "title": "POLICY_PRESCRIPTION",
      "body": "2 buckets · \"Netanyahu has pledged to ‘finish the job’ against Hezbollah. It’s a promise he can’t deliver on\n\nThe Israeli prime minister is using the ‘Gaza playbook’ to decimate southern Lebanon, but…",
      "kind": "frame",
      "source": {
        "bucket": "opinion_magazines",
        "url": "https://theconversation.com/netanyahu-has-pledged-to-finish-the-job-against-hezbollah-its-a-promise-he-cant-deliver-on-280468",
        "outlet": "The Conversation"
      }
    },
    {
      "title": "Silence as data",
      "body": "`usa` didn't cover this. They covered US coverage of Lebanon is absent from this corpus; US press appears to have subordinated Lebanon buffer-zone reporting to Hormuz ceasefire and Iran nuclear stori…",
      "kind": "silence"
    },
    {
      "title": "Daily framings",
      "body": "epistemic-lens · how the world tells the same story differently.",
      "kind": "callout"
    }
  ],
  "closing": "Read the full analysis: api/2026-05-12/lebanon_buffer/analysis.md",
  "generated_at": "2026-05-12T17:08:55Z",
  "model": "template:render_carousel.py",
  "meta_version": "8.7.3"
}
