{
  "story_key": "ukraine_war",
  "date": "2026-05-11",
  "title": "Ukraine military and territorial developments",
  "slides": [
    {
      "title": "Ukraine military and territorial developments",
      "body": "23 buckets · 38 articles · 3 frames",
      "kind": "callout"
    },
    {
      "title": "SECURITY_DEFENSE",
      "body": "2 buckets · \"Como a Ucrânia conseguiu usar a seu favor o tremendo impacto da guerra no Irã\n\nO presidente da Ucrân\" — brazil",
      "kind": "frame",
      "source": {
        "bucket": "brazil",
        "url": "https://www.bbc.com/portuguese/articles/c392123npm2o?at_medium=RSS&at_campaign=rss",
        "outlet": "BBC Brasil"
      }
    },
    {
      "title": "POLITICAL",
      "body": "2 buckets · \"Como a Ucrânia conseguiu usar a seu favor o tremendo impacto da guerra no Irã\n\nO presidente da Ucrân\" — brazil",
      "kind": "frame",
      "source": {
        "bucket": "brazil",
        "url": "https://www.bbc.com/portuguese/articles/c392123npm2o?at_medium=RSS&at_campaign=rss",
        "outlet": "BBC Brasil"
      }
    },
    {
      "title": "EXTERNAL_REGULATION",
      "body": "2 buckets · \"Como a Ucrânia conseguiu usar a seu favor o tremendo impacto da guerra no Irã\n\nO presidente da Ucrân\" — brazil",
      "kind": "frame",
      "source": {
        "bucket": "brazil",
        "url": "https://www.bbc.com/portuguese/articles/c392123npm2o?at_medium=RSS&at_campaign=rss",
        "outlet": "BBC Brasil"
      }
    },
    {
      "title": "Daily framings",
      "body": "epistemic-lens · how the world tells the same story differently.",
      "kind": "callout"
    }
  ],
  "closing": "Read the full analysis: api/2026-05-11/ukraine_war/analysis.md",
  "generated_at": "2026-05-11T17:37:18Z",
  "model": "template:render_carousel.py",
  "meta_version": "8.7.1"
}
